listing_id,source_url,listing_url,extraction_timestamp,detection_timestamp,data_quality_score,year,year_confidence,price,price_confidence,mileage,mileage_confidence,model,trim,model_confidence,trim_confidence,exterior,interior,exterior_confidence,interior_confidence,source,source_confidence,total_options,total_options_value,total_options_msrp,options_categories,options_list
1,https://www.autotempest.com/results?keywords=black%20edition&localization=country&make=porsche&maxyear=2012&minyear=2009&model=cayman&transmission=auto&zip=30214,https://www.cars.com/vehicledetail/e976df74-a8de-4fd2-b91f-c9d0568ef9ac/?aff=atempest&utm_campaign=atempest&utm_source=autotempest&utm_medium=trp&utm_campaign_id=1&utm_trusted=TRUE,2025-09-02T13:26:58.865687,2025-09-02T13:26:58.891978,1.0,2012,1.0,"$42,997",1.0,"76,885",1.0,Cayman,Black Edition,1.0,1.0,Black,Black,1.0,1.0,AutoTempest,1.0,0,8875,11435,"performance, exterior, appearance, comfort, technology, seating","Sport Exhaust (PSE), Bi-Xenon Headlights with Dynamic Cornering, 18–19"" Upgraded Wheels, Sport Chrono Package Plus, Sport Steering Wheel, Auto-dim Mirrors & Rain Sensor, BOSE Surround Sound, PCM w/ Navigation, Heated Seats"
2,https://www.autotempest.com/results?keywords=gts&localization=country&make=porsche&maxmiles=70000&maxprice=42000&minmiles=15000&minprice=39000&minyear=2018&model=macan&transmission=auto&zip=30214,https://www.cars.com/vehicledetail/57a09775-ff26-4874-8819-e7027934da23/?aff=atempest&utm_campaign=atempest&utm_source=autotempest&utm_medium=trp&utm_campaign_id=1&utm_trusted=TRUE,2025-09-02T13:26:58.866877,2025-09-02T13:26:58.896432,1.0,2020,1.0,"$41,787",1.0,"67,904",1.0,Macan,GTS,1.0,1.0,Carmine Red,Black,1.0,1.0,AutoTempest,1.0,0,9350,10800,"exterior, performance, appearance, comfort, seating, technology","Bi-Xenon Headlights with Dynamic Cornering, 18–19"" Upgraded Wheels, Sport Chrono Package Plus, Sport Steering Wheel, Auto-dim Mirrors & Rain Sensor, Sport Seats / Adaptive Sport Seats, BOSE Surround Sound, PCM w/ Navigation, Heated Seats, PASM"
3,https://www.autotempest.com/results?keywords=gts&localization=country&make=porsche&maxmiles=70000&maxprice=42000&minmiles=15000&minprice=39000&minyear=2018&model=macan&transmission=auto&zip=30214,https://www.cars.com/vehicledetail/81686837-76b7-49f2-be7c-bf7774b2be71/?aff=atempest&utm_campaign=atempest&utm_source=autotempest&utm_medium=trp&utm_campaign_id=1&utm_trusted=TRUE,2025-09-02T13:26:58.867027,2025-09-02T13:26:58.908454,1.0,2021,1.0,"$40,000",1.0,"39,555",1.0,Macan,Base,1.0,1.0,Volcano Grey Metallic,Black,1.0,1.0,AutoTempest,1.0,0,9590,11060,"performance, exterior, convenience, appearance, comfort, seating, technology","Sport Exhaust (PSE), Bi-Xenon Headlights with Dynamic Cornering, 18–19"" Upgraded Wheels, Limited Slip Differential (LSD), Park Assist, Sport Steering Wheel, Auto-dim Mirrors & Rain Sensor, Sport Seats / Adaptive Sport Seats, BOSE Surround Sound, PCM w/ Navigation, Heated Seats"
4,https://www.autotempest.com/results?keywords=gts&localization=country&make=porsche&maxmiles=70000&maxprice=42000&minmiles=15000&minprice=39000&minyear=2018&model=macan&transmission=auto&zip=30214,https://www.cars.com/vehicledetail/8fcc333a-9961-43b9-a021-bfa76331df77/?aff=atempest&utm_campaign=atempest&utm_source=autotempest&utm_medium=trp&utm_campaign_id=1&utm_trusted=TRUE,2025-09-02T13:26:58.867131,2025-09-02T13:26:58.937956,1.0,2018,1.0,"$41,991",1.0,"50,428",1.0,Macan,GTS,1.0,1.0,Carrara White Metallic,Garnet Red,1.0,1.0,AutoTempest,1.0,0,9250,10720,"performance, exterior, convenience, appearance, seating, technology","Sport Exhaust (PSE), Bi-Xenon Headlights with Dynamic Cornering, 18–19"" Upgraded Wheels, Limited Slip Differential (LSD), Park Assist, Sport Steering Wheel, Sport Seats / Adaptive Sport Seats, BOSE Surround Sound, Heated Seats, PASM"
5,https://www.autotempest.com/results?keywords=gts&localization=country&make=porsche&maxmiles=70000&maxprice=42000&minmiles=15000&minprice=39000&minyear=2018&model=macan&transmission=auto&zip=30214,https://www.cars.com/vehicledetail/c1022910-8deb-477e-8ddf-5d1486a54912/?aff=atempst&utm_campaign=atempst&utm_source=autotempest&utm_medium=trp&utm_campaign_id=1&utm_trusted=TRUE,2025-09-02T13:26:58.867226,2025-09-02T13:26:58.960176,1.0,2018,1.0,"$39,999",1.0,"62,650",1.0,Macan,GTS,1.0,1.0,Red,Gray,1.0,1.0,AutoTempest,1.0,0,8580,10360,"performance, exterior, convenience, appearance, technology, seating","Sport Exhaust (PSE), Bi-Xenon Headlights with Dynamic Cornering, 18–19"" Upgraded Wheels, Sport Chrono Package Plus, Park Assist, Sport Steering Wheel, BOSE Surround Sound, PCM w/ Navigation, Heated Seats, PASM"
